{
  "schemaVersion": 1,
  "version": "fielder_estimation_contract_v1",
  "calculation": "fielder-estimation",
  "independentVerifierId": "claude-delegator",
  "cases": [
    {
      "caseId": "interior-catcher-rectangle",
      "provenance": {
        "subjectKind": "legacy-pinned",
        "sources": [
          {
            "path": "masaki1025/Baseball_Scoring-archive@dd03160044aa5932d3b5a025870c9a5a56d979ef:frontend/src/lib/fielder.ts"
          },
          {
            "path": "docs/requirements/requirements-pitchlog-2026-07-22.md",
            "line": 238
          },
          {
            "path": "docs/requirements/requirements-pitchlog-2026-07-22.md",
            "line": 1305
          },
          {
            "path": "docs/requirements/requirements-pitchlog-2026-07-22.md",
            "line": 1307
          },
          {
            "path": "docs/requirements/requirements-pitchlog-2026-07-22.md",
            "line": 1316
          }
        ]
      },
      "input": {
        "coordinate": {
          "x": 123,
          "y": 33
        },
        "coordinateSystem": "normalized-bottom-left-units-1-263"
      },
      "expected": {
        "position": 2
      }
    },
    {
      "caseId": "interior-first-base-rectangle",
      "provenance": {
        "subjectKind": "legacy-pinned",
        "sources": [
          {
            "path": "masaki1025/Baseball_Scoring-archive@dd03160044aa5932d3b5a025870c9a5a56d979ef:frontend/src/lib/fielder.ts"
          },
          {
            "path": "docs/requirements/requirements-pitchlog-2026-07-22.md",
            "line": 238
          },
          {
            "path": "docs/requirements/requirements-pitchlog-2026-07-22.md",
            "line": 1305
          },
          {
            "path": "docs/requirements/requirements-pitchlog-2026-07-22.md",
            "line": 1307
          },
          {
            "path": "docs/requirements/requirements-pitchlog-2026-07-22.md",
            "line": 1316
          }
        ]
      },
      "input": {
        "coordinate": {
          "x": 180,
          "y": 83
        },
        "coordinateSystem": "normalized-bottom-left-units-1-263"
      },
      "expected": {
        "position": 3
      }
    },
    {
      "caseId": "interior-third-base-rectangle",
      "provenance": {
        "subjectKind": "legacy-pinned",
        "sources": [
          {
            "path": "masaki1025/Baseball_Scoring-archive@dd03160044aa5932d3b5a025870c9a5a56d979ef:frontend/src/lib/fielder.ts"
          },
          {
            "path": "docs/requirements/requirements-pitchlog-2026-07-22.md",
            "line": 238
          },
          {
            "path": "docs/requirements/requirements-pitchlog-2026-07-22.md",
            "line": 1305
          },
          {
            "path": "docs/requirements/requirements-pitchlog-2026-07-22.md",
            "line": 1307
          },
          {
            "path": "docs/requirements/requirements-pitchlog-2026-07-22.md",
            "line": 1316
          }
        ]
      },
      "input": {
        "coordinate": {
          "x": 50,
          "y": 78
        },
        "coordinateSystem": "normalized-bottom-left-units-1-263"
      },
      "expected": {
        "position": 5
      }
    },
    {
      "caseId": "interior-pitcher-rectangle",
      "provenance": {
        "subjectKind": "legacy-pinned",
        "sources": [
          {
            "path": "masaki1025/Baseball_Scoring-archive@dd03160044aa5932d3b5a025870c9a5a56d979ef:frontend/src/lib/fielder.ts"
          },
          {
            "path": "docs/requirements/requirements-pitchlog-2026-07-22.md",
            "line": 238
          },
          {
            "path": "docs/requirements/requirements-pitchlog-2026-07-22.md",
            "line": 1305
          },
          {
            "path": "docs/requirements/requirements-pitchlog-2026-07-22.md",
            "line": 1307
          },
          {
            "path": "docs/requirements/requirements-pitchlog-2026-07-22.md",
            "line": 1316
          }
        ]
      },
      "input": {
        "coordinate": {
          "x": 125,
          "y": 98
        },
        "coordinateSystem": "normalized-bottom-left-units-1-263"
      },
      "expected": {
        "position": 1
      }
    },
    {
      "caseId": "interior-anchor-8",
      "provenance": {
        "subjectKind": "legacy-pinned",
        "sources": [
          {
            "path": "masaki1025/Baseball_Scoring-archive@dd03160044aa5932d3b5a025870c9a5a56d979ef:frontend/src/lib/fielder.ts"
          },
          {
            "path": "docs/requirements/requirements-pitchlog-2026-07-22.md",
            "line": 238
          },
          {
            "path": "docs/requirements/requirements-pitchlog-2026-07-22.md",
            "line": 1305
          },
          {
            "path": "docs/requirements/requirements-pitchlog-2026-07-22.md",
            "line": 1307
          },
          {
            "path": "docs/requirements/requirements-pitchlog-2026-07-22.md",
            "line": 1316
          }
        ]
      },
      "input": {
        "coordinate": {
          "x": 116,
          "y": 197
        },
        "coordinateSystem": "normalized-bottom-left-units-1-263"
      },
      "expected": {
        "position": 8
      }
    },
    {
      "caseId": "interior-anchor-7",
      "provenance": {
        "subjectKind": "legacy-pinned",
        "sources": [
          {
            "path": "masaki1025/Baseball_Scoring-archive@dd03160044aa5932d3b5a025870c9a5a56d979ef:frontend/src/lib/fielder.ts"
          },
          {
            "path": "docs/requirements/requirements-pitchlog-2026-07-22.md",
            "line": 238
          },
          {
            "path": "docs/requirements/requirements-pitchlog-2026-07-22.md",
            "line": 1305
          },
          {
            "path": "docs/requirements/requirements-pitchlog-2026-07-22.md",
            "line": 1307
          },
          {
            "path": "docs/requirements/requirements-pitchlog-2026-07-22.md",
            "line": 1316
          }
        ]
      },
      "input": {
        "coordinate": {
          "x": 56,
          "y": 162
        },
        "coordinateSystem": "normalized-bottom-left-units-1-263"
      },
      "expected": {
        "position": 7
      }
    },
    {
      "caseId": "interior-anchor-9",
      "provenance": {
        "subjectKind": "legacy-pinned",
        "sources": [
          {
            "path": "masaki1025/Baseball_Scoring-archive@dd03160044aa5932d3b5a025870c9a5a56d979ef:frontend/src/lib/fielder.ts"
          },
          {
            "path": "docs/requirements/requirements-pitchlog-2026-07-22.md",
            "line": 238
          },
          {
            "path": "docs/requirements/requirements-pitchlog-2026-07-22.md",
            "line": 1305
          },
          {
            "path": "docs/requirements/requirements-pitchlog-2026-07-22.md",
            "line": 1307
          },
          {
            "path": "docs/requirements/requirements-pitchlog-2026-07-22.md",
            "line": 1316
          }
        ]
      },
      "input": {
        "coordinate": {
          "x": 174,
          "y": 162
        },
        "coordinateSystem": "normalized-bottom-left-units-1-263"
      },
      "expected": {
        "position": 9
      }
    },
    {
      "caseId": "interior-anchor-6",
      "provenance": {
        "subjectKind": "legacy-pinned",
        "sources": [
          {
            "path": "masaki1025/Baseball_Scoring-archive@dd03160044aa5932d3b5a025870c9a5a56d979ef:frontend/src/lib/fielder.ts"
          },
          {
            "path": "docs/requirements/requirements-pitchlog-2026-07-22.md",
            "line": 238
          },
          {
            "path": "docs/requirements/requirements-pitchlog-2026-07-22.md",
            "line": 1305
          },
          {
            "path": "docs/requirements/requirements-pitchlog-2026-07-22.md",
            "line": 1307
          },
          {
            "path": "docs/requirements/requirements-pitchlog-2026-07-22.md",
            "line": 1316
          }
        ]
      },
      "input": {
        "coordinate": {
          "x": 88,
          "y": 119
        },
        "coordinateSystem": "normalized-bottom-left-units-1-263"
      },
      "expected": {
        "position": 6
      }
    },
    {
      "caseId": "interior-anchor-4",
      "provenance": {
        "subjectKind": "legacy-pinned",
        "sources": [
          {
            "path": "masaki1025/Baseball_Scoring-archive@dd03160044aa5932d3b5a025870c9a5a56d979ef:frontend/src/lib/fielder.ts"
          },
          {
            "path": "docs/requirements/requirements-pitchlog-2026-07-22.md",
            "line": 238
          },
          {
            "path": "docs/requirements/requirements-pitchlog-2026-07-22.md",
            "line": 1305
          },
          {
            "path": "docs/requirements/requirements-pitchlog-2026-07-22.md",
            "line": 1307
          },
          {
            "path": "docs/requirements/requirements-pitchlog-2026-07-22.md",
            "line": 1316
          }
        ]
      },
      "input": {
        "coordinate": {
          "x": 152,
          "y": 119
        },
        "coordinateSystem": "normalized-bottom-left-units-1-263"
      },
      "expected": {
        "position": 4
      }
    },
    {
      "caseId": "interior-anchor-5",
      "provenance": {
        "subjectKind": "legacy-pinned",
        "sources": [
          {
            "path": "masaki1025/Baseball_Scoring-archive@dd03160044aa5932d3b5a025870c9a5a56d979ef:frontend/src/lib/fielder.ts"
          },
          {
            "path": "docs/requirements/requirements-pitchlog-2026-07-22.md",
            "line": 238
          },
          {
            "path": "docs/requirements/requirements-pitchlog-2026-07-22.md",
            "line": 1305
          },
          {